No,カラム名,カラム論理名,データ型,NULL有/無,主キー,パーティション定義,デフォルト値,元テーブル,元カラム,変換加工ロジック,説明/備考
1,cd_kaisya,会社コード,STRING,無,なし,なし,なし,${ai21Db}.TBV0205M,CD_KAISYA,CD_KAISYA をそのまま設定。,会社を識別するコード。DDL上は NOT NULL。メーカー候補を会社単位で管理するための項目。
2,cd_hansya,販社コード,STRING,無,なし,なし,なし,${ai21Db}.TBV0205M,CD_HANSYA,CD_HANSYA をそのまま設定。,販社を識別するコード。DDL上は NOT NULL。メーカー候補を販社単位で管理するための項目。
3,value,メーカーコード,STRING,無,なし,なし,なし,${ai21Db}.TBV0205M,CD_MAKER,CD_MAKER をそのまま設定。,画面・BIのフィルタ内部値として利用するメーカーコード。DDL上は VARCHAR(20) NOT NULL だが、ご指定に従い STRING として記載。
4,label,メーカー名,STRING,有,なし,なし,なし,${ai21Db}.TBV0205M,MJ_MAKERMEI,"REGEXP_REPLACE(MJ_MAKERMEI, '[　 ]+$', '') により、末尾の全角スペース・半角スペースを除去して設定。",メーカーコードに対応する表示名称。ユーザー画面ではこの名称が表示される想定。
5,mart_created_at,データ作成日時,STRING,無,なし,なし,CURRENT_TIMESTAMP,システム日時,CURRENT_TIMESTAMP,INSERT実行時に CURRENT_TIMESTAMP を設定。DDL上は DEFAULT CURRENT_TIMESTAMP だが、SQLでも明示的に CURRENT_TIMESTAMP を投入。,当該フィルタデータを作成した日時。ご指定により TIMESTAMP ではなく STRING として記載。
