No,カラム名,カラム論理名,データ型,NULL有/無,主キー,パーティション定義,デフォルト値,元テーブル,元カラム,変換加工ロジック,説明/備考
1,月,月,STRING,有,なし,なし,なし,months（CTE）,month,WITH句のmonths CTEで1〜12をUNION ALLにより生成し、months.month AS 月として出力。,集計対象月を表す項目。4月〜3月の会計年度ロジックに対応する月番号として使用。
2,販社コード,販社コード,STRING,有,なし,なし,なし,ai21rep_ve_dx.tbg7005m,cd_hansya,tbg7005m.cd_hansya をそのまま出力。,販社を識別するコード。dx_ve.vbi002001_enと販社・会社・店舗コードでINNER JOINされる。
3,会社コード,会社コード,STRING,有,なし,なし,なし,ai21rep_ve_dx.tbg7005m,cd_kaisya,tbg7005m.cd_kaisya をそのまま出力。,会社を識別するコード。dx_ve.vbi002001_enと販社・会社・店舗コードでINNER JOINされる。
4,販社会社店舗コード,販社会社店舗コード,STRING,有,なし,なし,なし,ai21rep_ve_dx.tbg7005m,"cd_hansya, cd_kaisya, cd_tenpo",tbg7005m.cd_hansya || tbg7005m.cd_kaisya || tbg7005m.cd_tenpo により連結して出力。,販社コード・会社コード・店舗コードを連結した店舗識別用コード。
5,前年売掛金残高,前年売掛金残高,STRING,有,なし,なし,なし,ai21rep_ve_dx.tbg7005m,"nu_yyyy, cd_kanjyou, ki_toyjkksy, ki_toykar01〜ki_toykar12, ki_toykas01〜ki_toykas12","前年会計年度（YEAR(MONTHS_SUB(JST現在日時,4))-1）かつ勘定科目 cd_kanjyou='10401  ' のレコードを対象に、月別に期首残高 ki_toyjkksy + 借方累計 ki_toykarXX - 貸方累計 ki_toykasXX を算出し、SUM後に /1000000。",前年の月別売掛金残高。4月は01、5月は01〜02、…、3月は01〜12までを累計する会計年度ベースの残高。単位は百万円換算。
6,前年売上額,前年売上額,STRING,有,なし,なし,なし,ai21rep_ve_dx.tbg7005m,"nu_yyyy, cd_kanjyou, ki_toykas01〜ki_toykas12, ki_toykar01〜ki_toykar12","前年会計年度（YEAR(MONTHS_SUB(JST現在日時,4))-1）かつ勘定科目 cd_kanjyou BETWEEN '5010101' AND '5019999' のレコードを対象に、月別に ki_toykasXX - ki_toykarXX を算出し、SUM後に /1000000。",前年の月別売上額。4月は01、5月は02、…、3月は12の月次額を使用。単位は百万円換算。
7,売掛金残高,売掛金残高,STRING,有,なし,なし,なし,ai21rep_ve_dx.tbg7005m,"nu_yyyy, cd_kanjyou, ki_toyjkksy, ki_toykar01〜ki_toykar12, ki_toykas01〜ki_toykas12","当年会計年度（YEAR(MONTHS_SUB(JST現在日時,4))）かつ勘定科目 cd_kanjyou='10401  ' のうち、実行時点のJST現在月より前の会計月のみを対象に、月別に期首残高 ki_toyjkksy + 借方累計 ki_toykarXX - 貸方累計 ki_toykasXX を算出し、SUM後に /1000000。",当年の月別売掛金残高。未到来月および当月は対象外となる条件付き。単位は百万円換算。
8,売上額,売上額,STRING,有,なし,なし,なし,ai21rep_ve_dx.tbg7005m,"nu_yyyy, cd_kanjyou, ki_toykas01〜ki_toykas12, ki_toykar01〜ki_toykar12","当年会計年度（YEAR(MONTHS_SUB(JST現在日時,4))）かつ勘定科目 cd_kanjyou BETWEEN '5010101' AND '5019999' のうち、実行時点のJST現在月より前の会計月のみを対象に、月別に ki_toykasXX - ki_toykarXX を算出し、SUM後に /1000000。",当年の月別売上額。未到来月および当月は対象外となる条件付き。単位は百万円換算。
